Polity,Start Year,End Year,Region,Overall Score,Phase Name,Phase Start,Phase End,Phase Score,Notes
Timurid Empire / 帖木儿帝国,1370,1507,Central Asia / 中亚,70,Fragmentation and Successor States,1448,1507,52,Dynastic splits and rising local polities reduced centralized capacity though cultural influence persisted.
Uzbek Khanate / 乌兹别克汗国,1428,1471,Central Asia / 中亚,37,Abu’l-Khayr Consolidation,1428,1457,37,Confederation-building under Abu’l-Khayr increased steppe military cohesion and regional influence.
Uzbek Khanate / 乌兹别克汗国,1428,1471,Central Asia / 中亚,37,Post-Abu’l-Khayr Fragmentation,1458,1471,30,Leadership crises and defections fragmented the polity and lowered composite strength.
Kazakh Khanate / 哈萨克汗国,1465,1847,Central Asia / 中亚,50,Formation and Early Expansion,1465,1598,44,Consolidation of tribal alliances and territorial expansion established the khanate’s foundations.
Kazakh Khanate / 哈萨克汗国,1465,1847,Central Asia / 中亚,50,Three Zhuz Structure (Apex),1599,1718,50,Decentralized confederation stabilized regional power and reached the polity’s overall peak.
Kazakh Khanate / 哈萨克汗国,1465,1847,Central Asia / 中亚,50,Dzungar Wars and Crisis,1719,1758,40,Intense conflict with neighboring powers weakened demographic and economic bases.
Kazakh Khanate / 哈萨克汗国,1465,1847,Central Asia / 中亚,50,Russian Encroachment and Decline,1759,1847,36,Gradual loss of sovereignty and incorporation into the Russian imperial system reduced autonomy and capacity.
Khanate of Bukhara / 布哈拉汗国,1501,1785,Central Asia / 中亚,49,Early Consolidation,1501,1600,44,Early Shaybanid consolidation of territory and trade routes with growing administrative structures.
Khanate of Bukhara / 布哈拉汗国,1501,1785,Central Asia / 中亚,49,Imperial Apex,1601,1740,49,"Height of centralized rule, Silk Road control and institutional strength."
Khanate of Bukhara / 布哈拉汗国,1501,1785,Central Asia / 中亚,49,Late Weakening,1741,1785,42,Internal fragmentation and rising external pressures reduced political and economic capacity.
Khanate of Khiva / 希瓦汗国,1511,1873,Central Asia / 中亚,43,Formation and Regional Rule,1511,1700,39,Early khanate formation with modest demographic and economic base.
Khanate of Khiva / 希瓦汗国,1511,1873,Central Asia / 中亚,43,Apex Khivan Khanate,1701,1800,43,"Relative political consolidation, trade control and cultural influence at its height."
Khanate of Khiva / 希瓦汗国,1511,1873,Central Asia / 中亚,43,Decline under Imperial Pressure,1801,1873,36,Gradual loss of autonomy and economic strain under growing Russian influence.
Hotak Dynasty / 汉达基王朝,1709,1738,Central Asia / 中亚,46,Rise and Conquest,1709,1722,44,Rapid local consolidation and military successes established short-lived regional power.
Hotak Dynasty / 汉达基王朝,1709,1738,Central Asia / 中亚,46,Peak Hotak Rule,1723,1730,46,Maximum territorial reach and military dominance under central leadership.
Hotak Dynasty / 汉达基王朝,1709,1738,Central Asia / 中亚,46,Collapse and Overthrow,1731,1738,38,Internal dissent and external counterattacks precipitated rapid collapse.
Khanate of Kokand / 浩罕汗国,1709,1876,Central Asia / 中亚,41,Foundation and Local Consolidation,1709,1770,38,Emergence of Kokand polity with growing regional trade and administrative institutions.
Khanate of Kokand / 浩罕汗国,1709,1876,Central Asia / 中亚,41,Expansion and Apex,1771,1840,41,"Territorial expansion, economic consolidation and cultural flourishing mark the high period."
Khanate of Kokand / 浩罕汗国,1709,1876,Central Asia / 中亚,41,Decline and Russian Pressure,1841,1876,35,Military defeats and colonial encroachment eroded sovereignty and economy.
Durrani Empire / 杜兰尼帝国,1747,1842,Central Asia / 中亚,53,Foundation and Zenith,1747,1793,53,"Ahmad Shah’s conquests created a large, militarized empire with strong administrative foundations."
Durrani Empire / 杜兰尼帝国,1747,1842,Central Asia / 中亚,53,Fragmentation and Regionalization,1794,1818,48,Successor fragmentation and regional power shifts reduced central control and economic cohesion.
Durrani Empire / 杜兰尼帝国,1747,1842,Central Asia / 中亚,53,Late Decline,1819,1842,40,Internal divisions and external pressures culminated in loss of imperial coherence.
Maimana Khanate / 迈马纳汗国,1747,1892,Central Asia / 中亚,37,Early Consolidation,1747,1820,34,Local khanate formation with limited demographic and economic base.
Maimana Khanate / 迈马纳汗国,1747,1892,Central Asia / 中亚,37,Late Survival,1821,1892,37,Adaptation to regional power shifts preserved autonomy though capacity remained limited.
Tashkent State / 塔什干国,1784,1808,Central Asia / 中亚,35,Tashkent Khanate,1784,1808,35,Short-lived emirate with urban trade significance but constrained territorial reach.
Emirate of Bukhara / 布哈拉酋长国,1785,1873,Central Asia / 中亚,41,Early Emirate Consolidation,1785,1825,38,Transition from khanate to emirate with strengthening of dynastic rule.
Emirate of Bukhara / 布哈拉酋长国,1785,1873,Central Asia / 中亚,41,Mid-Period Stability,1826,1865,41,Relative institutional stability and continued regional influence at peak capacity.
Emirate of Bukhara / 布哈拉酋长国,1785,1873,Central Asia / 中亚,41,Late Pressure and Decline,1866,1873,36,Russian and internal pressures reduced sovereignty and economic performance.
Emirate of Afghanistan / 阿富汗酋长国,1823,1926,Central Asia / 中亚,44,Barakzai Consolidation,1823,1878,42,Establishment of dynastic rule with expanding territorial administration.
Emirate of Afghanistan / 阿富汗酋长国,1823,1926,Central Asia / 中亚,44,Conflict and Adjustment,1879,1901,40,Anglo-Afghan conflicts and internal strain limited modernization and social welfare.
Emirate of Afghanistan / 阿富汗酋长国,1823,1926,Central Asia / 中亚,44,Modernizing Monarchy,1902,1926,44,Incremental administrative reforms and relative political stabilization raised composite strength.
Kara-Kyrgyz Khanate / 喀喇吉尔吉斯汗国,1842,1867,Central Asia / 中亚,27,Kara-Kyrgyz Period,1842,1867,27,Short-lived polity with limited territorial base and modest economic and administrative capacity.
Kingdom of Afghanistan / 阿富汗王国,1926,1973,Central Asia / 中亚,47,Nadir and Early Monarchy,1926,1933,45,Restoration of monarchy with consolidation of authority and modest modernization.
Kingdom of Afghanistan / 阿富汗王国,1926,1973,Central Asia / 中亚,47,Zahir Shah Era,1933,1973,47,Long peace and gradual modernization produced improved governance and economic indicators.
Republic of Afghanistan / 阿富汗共和国,1973,1978,Central Asia / 中亚,41,Republican Interlude,1973,1978,41,Brief republican rule with attempted modernization but rising political polarization.
Democratic Republic of Afghanistan / 阿富汗民主共和国,1978,1992,Central Asia / 中亚,35,Revolutionary Consolidation,1978,1984,33,Radical reforms and insurgency produced heavy social disruption and constrained economy.
Democratic Republic of Afghanistan / 阿富汗民主共和国,1978,1992,Central Asia / 中亚,35,Soviet Intervention and Stalemate,1985,1989,35,Soviet military presence stabilized regime but economic and governance costs remained high.
Democratic Republic of Afghanistan / 阿富汗民主共和国,1978,1992,Central Asia / 中亚,35,Post-Withdrawal Collapse,1990,1992,28,Withdrawal and renewed civil conflict sharply reduced state capacity.
Republic of Uzbekistan / 乌兹别克斯坦共和国,1991,2026,Central Asia / 中亚,52,Post-Soviet Transition,1991,1999,46,Authoritarian consolidation under Karimov with limited liberalization and rebuilding of institutions.
Republic of Uzbekistan / 乌兹别克斯坦共和国,1991,2026,Central Asia / 中亚,52,Authoritarian Consolidation and Stability,2000,2016,52,"Strong centralized control, economic stabilization, and increasing regional influence mark the peak."
Republic of Uzbekistan / 乌兹别克斯坦共和国,1991,2026,Central Asia / 中亚,52,Reform and International Engagement,2017,2026,50,Gradual policy opening and economic reforms improved governance and economic indicators while retaining authoritarian control.
Republic of Kazakhstan / 哈萨克斯坦共和国,1991,2026,Central Asia / 中亚,52,Early Independence and Shock Adjustment,1991,1999,45,Post-Soviet transition with economic shock and elite consolidation limited broad development.
Republic of Kazakhstan / 哈萨克斯坦共和国,1991,2026,Central Asia / 中亚,52,Oil Boom and Authoritarian Modernization,2000,2009,52,Resource-driven growth and state modernization raised the polity to its overall peak.
Republic of Kazakhstan / 哈萨克斯坦共和国,1991,2026,Central Asia / 中亚,52,Consolidation and Diversification Attempts,2010,2019,50,Continued centralized governance with efforts to diversify economy and strengthen institutions.
Republic of Kazakhstan / 哈萨克斯坦共和国,1991,2026,Central Asia / 中亚,52,Recent Political Adjustment,2020,2026,49,Political recalibration and social pressures moderated but did not reverse prior capacity.
Republic of Tajikistan / 塔吉克斯坦共和国,1991,2026,Central Asia / 中亚,38,Civil War and Fragmentation,1991,1996,24,"Civil conflict devastated institutions, population, and economic capacity."
Republic of Tajikistan / 塔吉克斯坦共和国,1991,2026,Central Asia / 中亚,38,Post-War Stabilization,1997,2009,34,Peace and authoritarian consolidation gradually rebuilt governance and economic activity.
Republic of Tajikistan / 塔吉克斯坦共和国,1991,2026,Central Asia / 中亚,38,Authoritarian Consolidation and Remittances,2010,2026,38,Strong central rule with reliance on remittances and limited institutional depth.
Turkmenistan / 土库曼斯坦,1991,2026,Central Asia / 中亚,37,Cult of Personality Era (Niyazov),1991,2006,30,Highly personalized rule with limited institutional development and uneven resource management.
Turkmenistan / 土库曼斯坦,1991,2026,Central Asia / 中亚,37,Post-Niyazov Transition,2007,2016,36,Incremental administrative strengthening under new leadership but continued authoritarianism.
Turkmenistan / 土库曼斯坦,1991,2026,Central Asia / 中亚,37,Contemporary Authoritarian Resource State,2017,2026,37,Resource-driven regime durability with constrained social and political freedoms.
Kyrgyz Republic / 吉尔吉斯共和国,1991,2026,Central Asia / 中亚,36,Initial Pluralization and Instability,1991,2004,31,Early experiments with pluralism mixed with elite fragmentation and weak institutions.
Kyrgyz Republic / 吉尔吉斯共和国,1991,2026,Central Asia / 中亚,36,Revolutions and Political Volatility,2005,2010,34,Repeated uprisings and turnover produced institutional instability but active civic life.
Kyrgyz Republic / 吉尔吉斯共和国,1991,2026,Central Asia / 中亚,36,Electoral Democracy and Fragile Governance,2011,2026,36,Comparatively open politics with persistent governance and economic constraints.
Islamic State of Afghanistan / 阿富汗伊斯兰国,1992,2002,Central Asia / 中亚,26,Mujahideen Fragmentation,1992,1995,20,Inter-factional warfare left weak central institutions and poor social outcomes.
Islamic State of Afghanistan / 阿富汗伊斯兰国,1992,2002,Central Asia / 中亚,26,Taliban Ascendancy,1996,2000,26,Taliban consolidated military control across most territory but governance and welfare were severely limited.
Islamic State of Afghanistan / 阿富汗伊斯兰国,1992,2002,Central Asia / 中亚,26,Transitional Collapse and International Intervention,2001,2002,22,US invasion and regime collapse produced a brief low-capacity transitional period.
Islamic Republic of Afghanistan / 阿富汗伊斯兰共和国,2004,2021,Central Asia / 中亚,43,Karzai Reconstruction Era,2004,2013,41,Post-2001 state-building with heavy international support improved governance and services modestly.
Islamic Republic of Afghanistan / 阿富汗伊斯兰共和国,2004,2021,Central Asia / 中亚,43,Ghani Years and Drawdown,2014,2021,43,Expanded institutions and limited economic gains counterbalanced by security challenges and corruption.
Islamic Emirate of Afghanistan / 阿富汗伊斯兰酋长国,2021,2026,Central Asia / 中亚,31,Taliban Rule (Post-2021),2021,2026,31,"Complete territorial control restored military authority but governance, rights, and economic openness remain constrained."
Hunnic Empire / 匈人帝国,370,469,Central Europe / 中欧,38,Migration and Rise,370,430,35,Rapid steppe mobilization and territorial expansion with emerging political cohesion.
Hunnic Empire / 匈人帝国,370,469,Central Europe / 中欧,38,Attila Apex,431,453,38,Peak military power and political dominance across Central Europe under centralized leadership.
Hunnic Empire / 匈人帝国,370,469,Central Europe / 中欧,38,Fragmentation and Collapse,454,469,30,Post-Attila succession crises and loss of cohesion produced rapid territorial disintegration.
Avar Khaganate / 阿瓦尔汗国,567,822,Central Europe / 中欧,43,Conquest and Consolidation,567,630,40,Early Avar expansion establishing khaganate control and tribute networks in the Carpathian basin.
Avar Khaganate / 阿瓦尔汗国,567,822,Central Europe / 中欧,43,Avar Apex,631,760,43,"Maximum territorial control, military strength, and regional influence across the plains."
Avar Khaganate / 阿瓦尔汗国,567,822,Central Europe / 中欧,43,Decline under Frankish Pressure,761,822,34,Military defeats and internal fragmentation reduced political and economic capacity.
Samo's Empire / 萨莫帝国,631,658,Central Europe / 中欧,27,Samo's Confederation,631,658,27,Short-lived Slavic confederation achieving regional military success but limited institutional depth.
Carantania / 卡兰塔尼亚,658,828,Central Europe / 中欧,27,Early Principality,658,740,25,Small mountain polity with limited population and economic base but local governance structures.
Carantania / 卡兰塔尼亚,658,828,Central Europe / 中欧,27,Frankish Integration and Autonomy,741,828,27,Increasing external influence but retained regional identity and modest political resilience.
Great Moravia / 大摩拉维亚公国,833,907,Central Europe / 中欧,38,Formation and Expansion,833,871,36,Consolidation of Slavic principalities and expansion through alliances and conquest.
Great Moravia / 大摩拉维亚公国,833,907,Central Europe / 中欧,38,Peak under Svatopluk,872,894,38,Territorial apex with strong political organization and cultural influence across the region.
Great Moravia / 大摩拉维亚公国,833,907,Central Europe / 中欧,38,Decline and Dissolution,895,907,32,Internal division and external pressure led to loss of central authority and fragmentation.
East Francia / 东法兰克王国,843,962,Central Europe / 中欧,44,Early Carolingian Continuity,843,887,42,Post-division consolidation preserved royal institutions and regional control.
East Francia / 东法兰克王国,843,962,Central Europe / 中欧,44,Ottonian Consolidation and Apex,888,962,44,"Strengthened royal administration, military organization, and cultural-political influence under Ottonian rulers."
Duchy of Bohemia / 波希米亚公国,870,1198,Central Europe / 中欧,43,Přemyslid Consolidation,870,1002,40,"Emergence of dynastic rule, local institution-building, and territorial consolidation."
Duchy of Bohemia / 波希米亚公国,870,1198,Central Europe / 中欧,43,Growth and Autonomy,1003,1100,43,Expanded political influence and cultural development while maintaining regional autonomy.
Duchy of Bohemia / 波希米亚公国,870,1198,Central Europe / 中欧,43,High Medieval Transition,1101,1198,39,Integration into wider Central European politics with stable institutions but limited expansion.
Grand Principality of Hungary / 匈牙利大公国,895,1000,Central Europe / 中欧,39,Migration and Settlement,895,955,38,Consolidation of Magyar groups and establishment of territorial control across the Carpathian Basin.
Grand Principality of Hungary / 匈牙利大公国,895,1000,Central Europe / 中欧,39,State Formation and Christianization,956,1000,39,Process of state-building and religious-political integration increased governance and regional standing.
Holy Roman Empire / 神圣罗马帝国,962,1806,Central Europe / 中欧,57,Early Imperial Formation,962,1155,50,Ottonian-Salian consolidation created institutional backbone and territorial core.
Holy Roman Empire / 神圣罗马帝国,962,1806,Central Europe / 中欧,57,Investiture & High Middle Ages,1156,1250,54,Expanded princely structures and economic integration increased composite capacity.
Holy Roman Empire / 神圣罗马帝国,962,1806,Central Europe / 中欧,57,Late Medieval Fragmentation,1251,1500,56,Relatively high cultural and economic influence despite growing political particularism.
Holy Roman Empire / 神圣罗马帝国,962,1806,Central Europe / 中欧,57,Early Modern Complexity,1501,1806,57,"Peak institutional complexity, economic weight, and enduring cultural-legal influence to 1806."
Civitas Schinesghe / 波兰公国,966,1025,Central Europe / 中欧,31,Polanic Consolidation,966,992,28,Initial state formation under Mieszko I with limited demographic and economic reach.
Civitas Schinesghe / 波兰公国,966,1025,Central Europe / 中欧,31,Piast Expansion and Coronation,993,1025,31,Bolesław’s consolidation increased territorial control and international standing.
Kingdom of Hungary / 匈牙利王国,1000,1526,Central Europe / 中欧,57,Árpádian Consolidation,1000,1301,52,State formation and medieval consolidation expanded institutions and regional influence.
Kingdom of Hungary / 匈牙利王国,1000,1526,Central Europe / 中欧,57,High Medieval Apex,1302,1526,57,"Peak territorial, military, and institutional strength culminating before Mohács."
Kingdom of Poland / 波兰王国,1025,1569,Central Europe / 中欧,60,Piast Consolidation,1025,1385,55,Fragmentation and reunification produced steady growth in governance and cultural output.
Kingdom of Poland / 波兰王国,1025,1569,Central Europe / 中欧,60,Jagiellonian Apex,1386,1569,60,"Territorial expansion, dynastic unions, and cultural florescence mark the polity’s high point."
Kingdom of Bohemia / 波希米亚王国,1198,1620,Central Europe / 中欧,50,Přemyslid and Early Growth,1198,1310,45,Dynastic consolidation and regional trade fostered steady institutional development.
Kingdom of Bohemia / 波希米亚王国,1198,1620,Central Europe / 中欧,50,Charlesian Apex,1311,1378,50,"Under Luxembourg rule cultural, economic, and political influence reached a peak."
Kingdom of Bohemia / 波希米亚王国,1198,1620,Central Europe / 中欧,50,Late Medieval to Early Modern Transition,1379,1620,48,Continued cultural importance but increasing external pressures and confessional conflict.
State of the Teutonic Order / 条顿骑士团国,1226,1525,Central Europe / 中欧,46,Conquest & Crusading Expansion,1226,1350,42,Military-religious state-building created territorial control and economic bases in Prussia.
State of the Teutonic Order / 条顿骑士团国,1226,1525,Central Europe / 中欧,46,Apex and Administrative Maturity,1351,1410,46,Administrative consolidation and economic integration mark the high point before Grunwald.
State of the Teutonic Order / 条顿骑士团国,1226,1525,Central Europe / 中欧,46,Decline and Secularization,1411,1525,39,Military defeat and political isolation led to territorial loss and institutional weakening.
Electorate of Saxony / 萨克森选侯国,1356,1806,Central Europe / 中欧,49,Late Medieval Electorate,1356,1499,45,Electoral establishment with growing regional princely authority and economic bases.
Electorate of Saxony / 萨克森选侯国,1356,1806,Central Europe / 中欧,49,Reformation and Electoral Prominence,1500,1648,49,Religious leadership and cultural-economic strength elevated the electorate’s influence.
Electorate of Saxony / 萨克森选侯国,1356,1806,Central Europe / 中欧,49,Early Modern Consolidation,1649,1806,47,Recovery and institutional resilience preserved significant regional capacity into the Napoleonic era.
Archduchy of Austria (Habsburg Monarchy) / 奥地利大公国（哈布斯堡君主国）,1453,1804,Central Europe / 中欧,67,Habsburg Consolidation and Border Defense,1453,1526,58,Early territorial consolidation and defense against Ottoman expansion strengthened administration.
Archduchy of Austria (Habsburg Monarchy) / 奥地利大公国（哈布斯堡君主国）,1453,1804,Central Europe / 中欧,67,Counter-Reformation and Institutional Growth,1527,1648,62,Administrative centralization and confessional consolidation increased governance capacity.
Archduchy of Austria (Habsburg Monarchy) / 奥地利大公国（哈布斯堡君主国）,1453,1804,Central Europe / 中欧,67,Imperial Hegemony and Military Consolidation,1649,1740,65,Dynastic expansion and military strengthening increased regional influence.
Archduchy of Austria (Habsburg Monarchy) / 奥地利大公国（哈布斯堡君主国）,1453,1804,Central Europe / 中欧,67,Reform and Late Habsburg Strength,1741,1804,67,Administrative reforms and fiscal modernization produced peak institutional capacity.
Duchy of Prussia / 普鲁士公国（勃兰登堡-普鲁士）,1525,1701,Central Europe / 中欧,42,Ducal Foundation under Polish Suzerainty,1525,1618,36,Small duchy with limited autonomy and modest economic and military capacity.
Duchy of Prussia / 普鲁士公国（勃兰登堡-普鲁士）,1525,1701,Central Europe / 中欧,42,Brandenburg-Prussia Personal Union and Consolidation,1619,1688,40,Union with Brandenburg strengthened administrative and territorial integration.
Duchy of Prussia / 普鲁士公国（勃兰登堡-普鲁士）,1525,1701,Central Europe / 中欧,42,Militarization and Kingdom Preparation,1689,1701,42,Military expansion and fiscal reform prepared elevation to a kingdom.
Polish-Lithuanian Commonwealth / 波兰立陶宛联邦,1569,1795,Central Europe / 中欧,60,Union and Golden Age,1569,1648,60,Large federative state with strong cultural output and extensive territory.
Polish-Lithuanian Commonwealth / 波兰立陶宛联邦,1569,1795,Central Europe / 中欧,60,Crisis and Military Strain,1649,1688,52,Wars and internal instability weakened governance and economy.
Polish-Lithuanian Commonwealth / 波兰立陶宛联邦,1569,1795,Central Europe / 中欧,60,Saxon Era Recovery Attempts,1689,1763,56,Partial stabilization occurred but systemic political weaknesses persisted.
Polish-Lithuanian Commonwealth / 波兰立陶宛联邦,1569,1795,Central Europe / 中欧,60,Terminal Decline and Partitions,1764,1795,40,External intervention and institutional paralysis led to state collapse.
Electorate of Bavaria / 巴伐利亚选侯国,1623,1806,Central Europe / 中欧,44,War and Reconstruction,1623,1700,40,Thirty Years' War devastation followed by gradual rebuilding.
Electorate of Bavaria / 巴伐利亚选侯国,1623,1806,Central Europe / 中欧,44,Electoral Consolidation and Cultural Growth,1701,1806,44,Administrative stabilization and cultural development marked peak strength.
Electorate of Brunswick-Lunenburg / 不伦瑞克-吕讷堡选侯国,1692,1807,Central Europe / 中欧,39,Early Electoral Formation,1692,1713,36,Initial establishment of electoral institutions with limited power base.
Electorate of Brunswick-Lunenburg / 不伦瑞克-吕讷堡选侯国,1692,1807,Central Europe / 中欧,39,Personal Union Influence Era,1714,1807,39,Personal union with Britain increased diplomatic and economic standing.
Kingdom of Prussia / 普鲁士王国,1701,1871,Central Europe / 中欧,63,Early Kingdom Formation,1701,1740,50,Administrative modernization and consolidation built foundations of state power.
Kingdom of Prussia / 普鲁士王国,1701,1871,Central Europe / 中欧,63,Frederickian Military State,1741,1806,60,Military success and bureaucratic efficiency raised Prussia to great power status.
Kingdom of Prussia / 普鲁士王国,1701,1871,Central Europe / 中欧,63,Reform and Industrial Expansion,1807,1861,62,"Post-Napoleonic reforms strengthened economy, governance, and technology."
Kingdom of Prussia / 普鲁士王国,1701,1871,Central Europe / 中欧,63,Bismarckian Unification Peak,1862,1871,63,Military victories and diplomatic strategy culminated in German unification.
Principality of Liechtenstein / 列支敦士登亲王国,1719,2026,Central Europe / 中欧,44,Early Principality Formation,1719,1805,28,Small sovereign court-state with limited population and economic base.
Principality of Liechtenstein / 列支敦士登亲王国,1719,2026,Central Europe / 中欧,44,Mediatization and Adaptation,1806,1918,32,Loss of immediacy but continued dynastic stability and gradual administrative consolidation.
Principality of Liechtenstein / 列支敦士登亲王国,1719,2026,Central Europe / 中欧,44,Interwar Neutrality and Financial Foundations,1919,1945,34,Neutral stance and beginning of fiscal/financial identity increased resilience.
Principality of Liechtenstein / 列支敦士登亲王国,1719,2026,Central Europe / 中欧,44,Postwar Modernization,1946,1990,36,Sustained institutional development and economic modernization raise composite strength.
Principality of Liechtenstein / 列支敦士登亲王国,1719,2026,Central Europe / 中欧,44,Integration and Financial-State Maturity,1991,2026,44,Service-oriented economy and strong governance produce the polity’s current peak.
Helvetic Republic / 海尔维第共和国,1798,1803,Central Europe / 中欧,29,Helvetic Republic (single phase),1798,1803,29,Short-lived centralized republic with weak institutional depth and heavy external influence.
