Polity,Start Year,End Year,Region,Overall Score,Phase Name,Phase Start,Phase End,Phase Score,Notes
Valais Republic / 瓦莱共和国,1802,1810,Central Europe / 中欧,23,Valais Republic (single phase),1802,1810,23,Brief revolutionary-era polity with minimal territorial/population base and low institutional capacity.
Electorate of Hesse / 黑森选侯国,1803,1866,Central Europe / 中欧,36,Napoleonic Transformation,1803,1814,30,Political restructuring under Napoleonic dominance with limited economic expansion.
Electorate of Hesse / 黑森选侯国,1803,1866,Central Europe / 中欧,36,Restoration and Conservative Order,1815,1847,34,Post-Napoleonic recovery and conservative institutional consolidation.
Electorate of Hesse / 黑森选侯国,1803,1866,Central Europe / 中欧,36,Revolutionary Upheaval,1848,1851,28,Brief political turbulence reduced governance and economic performance.
Electorate of Hesse / 黑森选侯国,1803,1866,Central Europe / 中欧,36,Late Electorate Stability,1852,1866,36,Administrative stabilization and modest economic improvement prior to annexation.
Austrian Empire / 奥地利帝国,1804,1867,Central Europe / 中欧,59,Founding and Napoleonic Era,1804,1814,50,Creation under Habsburg dynasty with wartime mobilization and administrative consolidation.
Austrian Empire / 奥地利帝国,1804,1867,Central Europe / 中欧,59,Metternich Order and Institutional Consolidation,1815,1847,56,Conservative international role and strengthened fiscal-administrative systems.
Austrian Empire / 奥地利帝国,1804,1867,Central Europe / 中欧,59,Revolutionary Crisis and Short-Term Disruption,1848,1851,45,Revolutions reduced short-term governance effectiveness and economic stability.
Austrian Empire / 奥地利帝国,1804,1867,Central Europe / 中欧,59,Bach System and Reformed Habsburg Strength,1852,1867,59,Administrative reforms and regained political-economic capacity define the peak phase.
Kingdom of Bavaria / 巴伐利亚王国,1806,1871,Central Europe / 中欧,50,Kingdom Foundation and Napoleonic Alignment,1806,1814,44,Elevation to kingdom with institutional reshaping under Napoleonic influence.
Kingdom of Bavaria / 巴伐利亚王国,1806,1871,Central Europe / 中欧,50,Restoration and State-Building,1815,1847,48,Administrative consolidation and economic recovery increase composite strength.
Kingdom of Bavaria / 巴伐利亚王国,1806,1871,Central Europe / 中欧,50,Revolutionary Disturbance,1848,1851,42,Political unrest temporarily weakened governance and economic performance.
Kingdom of Bavaria / 巴伐利亚王国,1806,1871,Central Europe / 中欧,50,Industrializing Consolidation,1852,1871,50,Modernization and institutional maturity produce the polity’s apex.
Kingdom of Saxony / 萨克森王国,1806,1871,Central Europe / 中欧,48,Kingdom Creation and Napoleonic Aftermath,1806,1814,42,Elevation to kingdom with limited resources but important regional position.
Kingdom of Saxony / 萨克森王国,1806,1871,Central Europe / 中欧,48,Restoration and Cultural-Economic Growth,1815,1847,46,Recovery with significant cultural and proto-industrial development.
Kingdom of Saxony / 萨克森王国,1806,1871,Central Europe / 中欧,48,Revolutionary Shock,1848,1851,40,Short-term political instability reduced composite indicators.
Kingdom of Saxony / 萨克森王国,1806,1871,Central Europe / 中欧,48,Late Modernization and Integration,1852,1871,48,Industrial growth and administrative strengthening mark the high phase.
Grand Duchy of Baden / 巴登大公国,1806,1871,Central Europe / 中欧,47,Grand Duchy Foundation and Reform,1806,1814,42,Creation and early administrative reforms under Napoleonic settlement.
Grand Duchy of Baden / 巴登大公国,1806,1871,Central Europe / 中欧,47,Constitutional Development and Economic Growth,1815,1847,45,Constitutional reform and economic modernization improved composite strength.
Grand Duchy of Baden / 巴登大公国,1806,1871,Central Europe / 中欧,47,Revolutionary Interruption,1848,1851,39,Revolutionary disturbances temporarily reduced governance and stability.
Grand Duchy of Baden / 巴登大公国,1806,1871,Central Europe / 中欧,47,Industrial Consolidation,1852,1871,47,Economic modernization and administrative consolidation reach the polity’s peak.
Kingdom of Württemberg / 符腾堡王国,1806,1871,Central Europe / 中欧,45,Kingdom Establishment,1806,1814,40,Elevation to kingdom with state reorganization and limited economic base.
Kingdom of Württemberg / 符腾堡王国,1806,1871,Central Europe / 中欧,45,Restoration and Institutional Growth,1815,1847,43,Post-Napoleonic reforms and moderate economic development strengthen governance.
Kingdom of Württemberg / 符腾堡王国,1806,1871,Central Europe / 中欧,45,Revolutionary Period,1848,1851,37,Political upheaval temporarily reduced institutional effectiveness.
Kingdom of Württemberg / 符腾堡王国,1806,1871,Central Europe / 中欧,45,Late Consolidation and Modernization,1852,1871,45,Administrative reform and economic improvement mark the late peak.
Grand Duchy of Hesse / 黑森大公国,1806,1871,Central Europe / 中欧,38,Formation and Napoleonic Alignment,1806,1814,32,State creation under Napoleonic reorganization with limited resources.
Grand Duchy of Hesse / 黑森大公国,1806,1871,Central Europe / 中欧,38,Restoration and Moderate Growth,1815,1847,36,Gradual institutional development and regional economic contribution.
Grand Duchy of Hesse / 黑森大公国,1806,1871,Central Europe / 中欧,38,Revolutionary Disturbance,1848,1851,30,Revolutionary events constrained governance and social stability.
Grand Duchy of Hesse / 黑森大公国,1806,1871,Central Europe / 中欧,38,Late Institutional Stabilization,1852,1871,38,Post-revolution consolidation and modest economic gains restored composite strength.
Duchy of Nassau / 拿骚公国,1806,1866,Central Europe / 中欧,33,Napoleonic Creation and Early Rule,1806,1815,28,Created under Napoleonic order with limited autonomy and modest resources.
Duchy of Nassau / 拿骚公国,1806,1866,Central Europe / 中欧,33,Restoration and Administrative Consolidation,1816,1847,31,Post-Napoleonic stabilization improved institutions but economic base remained small.
Duchy of Nassau / 拿骚公国,1806,1866,Central Europe / 中欧,33,Revolutionary Turbulence,1848,1851,26,Revolutionary unrest temporarily weakened governance and fiscal capacity.
Duchy of Nassau / 拿骚公国,1806,1866,Central Europe / 中欧,33,Late Electorate Stability and Annexation,1852,1866,33,Relative administrative consolidation prior to Prussian annexation marks the polity’s peak.
Duchy of Warsaw / 华沙公国,1807,1815,Central Europe / 中欧,36,Napoleonic Client State,1807,1815,36,Short-lived Napoleonic duchy with mobilized administration but limited longevity and resources.
Kingdom of Hanover / 汉诺威王国,1814,1866,Central Europe / 中欧,38,Restoration and Dynastic Consolidation,1814,1837,35,Reestablished monarchy with conservative institutions and modest modernization.
Kingdom of Hanover / 汉诺威王国,1814,1866,Central Europe / 中欧,38,Industrial and Administrative Growth,1838,1856,37,Infrastructure and economic development strengthened state capacity.
Kingdom of Hanover / 汉诺威王国,1814,1866,Central Europe / 中欧,38,Pre-Unification Crisis and Annexation,1857,1866,38,Political-military tensions and Prussian ascendancy culminated in annexation.
Grand Duchy of Mecklenburg-Schwerin / 梅克伦堡-什未林大公国,1815,1871,Central Europe / 中欧,33,Post-Napoleonic Restoration,1815,1847,30,Conservative restoration limited reform and economic expansion.
Grand Duchy of Mecklenburg-Schwerin / 梅克伦堡-什未林大公国,1815,1871,Central Europe / 中欧,33,1848 Turmoil and Slow Modernization,1848,1851,28,Revolutionary disturbances slowed institutional progress.
Grand Duchy of Mecklenburg-Schwerin / 梅克伦堡-什未林大公国,1815,1871,Central Europe / 中欧,33,Late Administrative Consolidation,1852,1871,33,Gradual modernization and stability improved composite indicators before German unification.
Swiss Confederation / 瑞士联邦,1848,2026,Central Europe / 中欧,63,Federal Founding and Institutional Formation,1848,1874,55,Creation of a federal constitution established durable institutions and rule of law.
Swiss Confederation / 瑞士联邦,1848,2026,Central Europe / 中欧,63,Industrialization and Neutrality Consolidation,1875,1914,60,Industrial growth and firm neutrality expanded economy and international standing.
Swiss Confederation / 瑞士联邦,1848,2026,Central Europe / 中欧,63,World Wars and Social Consolidation,1915,1945,58,Neutrality preserved sovereignty while social cohesion and institutional resilience deepened.
Swiss Confederation / 瑞士联邦,1848,2026,Central Europe / 中欧,63,Postwar Prosperity and Institutional Peak,1946,1990,63,"High economic development, social welfare, and strong governance mark the peak phase."
Swiss Confederation / 瑞士联邦,1848,2026,Central Europe / 中欧,63,Contemporary Integration and Stability,1991,2026,62,Continued high governance and economic strength with globalization-era adjustments.
Austria-Hungary / 奥匈帝国,1867,1918,Central Europe / 中欧,61,Austro-Hungarian Compromise and Formation,1867,1890,58,Creation of dual monarchy stabilized governance and expanded industrialization.
Austria-Hungary / 奥匈帝国,1867,1918,Central Europe / 中欧,61,Belle Époque Apex,1891,1913,61,"Economic growth, cultural florescence, and strong multinational administration mark the peak."
Austria-Hungary / 奥匈帝国,1867,1918,Central Europe / 中欧,61,World War I and Collapse,1914,1918,36,Mass mobilization and defeat precipitated imperial disintegration and institutional collapse.
German Empire / 德意志帝国,1871,1918,Central Europe / 中欧,80,Unification and Bismarckian Consolidation,1871,1890,70,"State-building, administrative modernization, and industrial growth laid the foundation for great-power status."
German Empire / 德意志帝国,1871,1918,Central Europe / 中欧,80,Wilhelmine Expansion and Peak,1891,1913,80,"Rapid industrial, military, and scientific ascendancy produce the polity’s apex in composite strength."
German Empire / 德意志帝国,1871,1918,Central Europe / 中欧,80,World War I and Dissolution,1914,1918,50,"Total war strained economy and society, ending in defeat and imperial collapse."
