Polity,Start Year,End Year,Region,Overall Score,Phase Name,Phase Start,Phase End,Phase Score,Notes
Central African Empire / 中非帝国,1976,1979,Central Africa / 中非,22,Empire Period,1976,1979,22,Short-lived imperial transformation concentrated power but worsened international standing and economy.
Central African Republic / 中非共和国,1979,2026,Central Africa / 中非,24,Post-Empire Transition,1979,1992,22,Restoration of republic saw recurrent coups and weak institutional rebuilding.
Central African Republic / 中非共和国,1979,2026,Central Africa / 中非,24,Electoral Experimentation and Coups,1993,2002,24,Periodic attempts at democratic governance produced limited stability and social gains.
Central African Republic / 中非共和国,1979,2026,Central Africa / 中非,24,Authoritarian Return and Civil War,2003,2012,20,Armed conflict and state fragmentation severely reduced governance and services.
Central African Republic / 中非共和国,1979,2026,Central Africa / 中非,24,International Stabilization and Fragility,2013,2026,23,International interventions achieved partial stabilization but long-term recovery remains limited.
Republic of the Congo (Brazzaville) / 刚果共和国（布拉柴维尔）,1992,2026,Central Africa / 中非,35,Multiparty Transition,1992,1997,30,Initial democratic opening enhanced political pluralism but economic base remained narrow.
Republic of the Congo (Brazzaville) / 刚果共和国（布拉柴维尔）,1992,2026,Central Africa / 中非,35,Civil War and Regression,1998,2002,28,Violent conflict undermined institutions and economic activity.
Republic of the Congo (Brazzaville) / 刚果共和国（布拉柴维尔）,1992,2026,Central Africa / 中非,35,Post-Conflict Oil Consolidation,2003,2026,35,Oil revenues and centralized governance restored fiscal capacity and regional influence.
Democratic Republic of the Congo (Kinshasa) / 刚果民主共和国（金沙萨）,1997,2026,Central Africa / 中非,35,Second Congo War and Fragmentation,1997,2002,25,Large-scale regional war and state disintegration sharply reduced capacity.
Democratic Republic of the Congo (Kinshasa) / 刚果民主共和国（金沙萨）,1997,2026,Central Africa / 中非,35,Post-War Reconstruction and Resource Recovery,2003,2018,33,International interventions and resource rents partially rebuilt institutions and economy.
Democratic Republic of the Congo (Kinshasa) / 刚果民主共和国（金沙萨）,1997,2026,Central Africa / 中非,35,Contemporary Transition and International Engagement,2019,2026,35,Improved political management and external support increased stability and governance.
Mutal / 穆塔尔,90,869,Central America / 中美,57,Early Classic Formation,90,378,50,Early state consolidation with growing political centers but limited population and economy.
Mutal / 穆塔尔,90,869,Central America / 中美,57,Classic Apex,379,562,57,"Peak urbanization, monumentality, and cultural-technological florescence across the polity."
Mutal / 穆塔尔,90,869,Central America / 中美,57,Terminal Decline,563,869,45,"Late-period fragmentation, population decline, and loss of central authority."
Kaan / 卡安,400,950,Central America / 中美,54,Formation and Rivalry,400,599,48,State formation amid interstate rivalry with growing elite complexity.
Kaan / 卡安,400,950,Central America / 中美,54,Classic Hegemony,600,790,54,Apex of political-military influence and cultural production in the Classic period.
Kaan / 卡安,400,950,Central America / 中美,54,Late Contraction,791,950,42,Loss of hegemony and regional fragmentation reduced composite strength.
Toltec Empire / 托尔特克帝国,510,1122,Central America / 中美,56,Proto-Toltec Formation,510,900,44,Long developmental phase of regional polities and increasing urban complexity.
Toltec Empire / 托尔特克帝国,510,1122,Central America / 中美,56,Toltec Apex,901,1030,56,Political-military dominance and cultural influence across central Mesoamerica.
Toltec Empire / 托尔特克帝国,510,1122,Central America / 中美,56,Late Fragmentation,1031,1122,48,Decline in central authority and economic integration before collapse.
League of Mayapan / 玛雅潘联盟,1007,1441,Central America / 中美,38,Formation and Regional Alliance,1007,1200,34,Emergence of a federative polity binding several northern Yucatecan cities.
League of Mayapan / 玛雅潘联盟,1007,1441,Central America / 中美,38,Apex Confederation,1201,1400,38,Relative political cohesion and peak trade/cultural coordination in the league.
League of Mayapan / 玛雅潘联盟,1007,1441,Central America / 中美,38,Collapse and Dispersion,1401,1441,30,Internal strife and collapse dissolved the confederation and reduced regional capacity.
Aztec Empire / 阿兹特克帝国,1428,1521,Central America / 中美,60,Foundation and Alliance Building,1428,1469,55,Formation of the Triple Alliance and consolidation of tributary networks.
Aztec Empire / 阿兹特克帝国,1428,1521,Central America / 中美,60,Expansion and Apex,1470,1519,60,"Territorial expansion, strong military-economy, and cultural ascendancy mark the high point."
Aztec Empire / 阿兹特克帝国,1428,1521,Central America / 中美,60,Conquest and Collapse,1520,1521,40,Rapid military defeat and institutional collapse under Spanish conquest.
Mexican Empire (First Empire) / 墨西哥帝国（第一帝国）,1821,1823,Central America / 中美,36,Independent Imperial Interlude,1821,1823,36,Short-lived imperial government with limited institutional consolidation and economic base.
United Mexican States (First Republic) / 墨西哥合众国（第一共和国）,1823,1835,Central America / 中美,39,Early Republican Formation,1823,1828,36,Post-imperial state-building with weak administrative capacity and factionalism.
United Mexican States (First Republic) / 墨西哥合众国（第一共和国）,1823,1835,Central America / 中美,39,Political Polarization and Weak Growth,1829,1835,39,Intensified factional conflict and constrained economic/political consolidation.
Federal Republic of Central America / 中美洲联邦共和国,1823,1841,Central America / 中美,31,Federal Consolidation,1823,1838,31,Initial union-building with modest economic links and limited institutional depth.
Federal Republic of Central America / 中美洲联邦共和国,1823,1841,Central America / 中美,31,Dissolution and Fragmentation,1839,1841,25,Rapid political breakdown and secession reduced the federation’s composite strength.
Mexican Republic (Centralist Republic) / 墨西哥共和国（集权共和国）,1835,1846,Central America / 中美,36,Centralist Republic,1835,1846,36,Centralized political experiment with modest administrative gains but continued instability and economic limits.
Republic of Nicaragua / 尼加拉瓜共和国,1838,2026,Central America / 中美,44,Early Republican Formation,1838,1893,36,Fragmented post-colonial state-building with limited economy and demographic base.
Republic of Nicaragua / 尼加拉瓜共和国,1838,2026,Central America / 中美,44,US Influence and Political Realignment,1894,1933,38,Increasing foreign intervention and elite consolidation raised administrative but not social capacity.
Republic of Nicaragua / 尼加拉瓜共和国,1838,2026,Central America / 中美,44,Somoza Dynasty Consolidation,1934,1979,40,Authoritarian stability improved territorial control and economic extractive capacity at the expense of governance quality.
Republic of Nicaragua / 尼加拉瓜共和国,1838,2026,Central America / 中美,44,Sandinista Revolutionary Period,1980,1990,42,High mobilization and social-program investment increased governance reach despite external pressures.
Republic of Nicaragua / 尼加拉瓜共和国,1838,2026,Central America / 中美,44,Post-Revolution Contemporary Era,1991,2026,44,Pluralized politics with mixed economic performance and stabilized institutions at the present baseline.
Free State of Costa Rica / 哥斯达黎加自由邦,1838,1847,Central America / 中美,31,Free State Period,1838,1847,31,Short-lived polity with limited institutional depth but emerging local governance structures.
State of Los Altos / 洛斯阿尔托斯国,1838,1840,Central America / 中美,20,Los Altos Interlude,1838,1840,20,Brief secessionist state with minimal territorial/population base and weak institutions.
Republic of Guatemala / 危地马拉共和国,1839,2026,Central America / 中美,46,Conservative Early Republic,1839,1870,38,Post-federation conservative order with limited modernization and uneven control.
Republic of Guatemala / 危地马拉共和国,1839,2026,Central America / 中美,46,Liberal Reform and Oligarchic Growth,1871,1943,44,Liberal modernization and coffee export growth strengthened economy and state capacity.
Republic of Guatemala / 危地马拉共和国,1839,2026,Central America / 中美,46,1944–1953 Democratic Reform,1944,1953,46,Social and land reforms temporarily increased social welfare and cultural dynamism.
Republic of Guatemala / 危地马拉共和国,1839,2026,Central America / 中美,46,Cold War Era and Civil Conflict,1954,1996,33,Coup-driven repression and prolonged civil war severely reduced governance and welfare.
Republic of Guatemala / 危地马拉共和国,1839,2026,Central America / 中美,46,Post-Peace Institutional Recovery,1997,2026,46,Peace accords and gradual institutional strengthening improved economy and governance.
Republic of Honduras / 洪都拉斯共和国,1839,2026,Central America / 中美,41,Early Republican Consolidation,1839,1899,34,Fragmented elites and limited economic diversification constrained state capacity.
Republic of Honduras / 洪都拉斯共和国,1839,2026,Central America / 中美,41,Banana-Era Integration,1900,1932,38,Increasing export-led growth under foreign firms raised economy but weakened governance independence.
Republic of Honduras / 洪都拉斯共和国,1839,2026,Central America / 中美,41,Military Dominance,1933,1979,36,Authoritarian rule provided order and some infrastructure but limited social development.
Republic of Honduras / 洪都拉斯共和国,1839,2026,Central America / 中美,41,Democratic Transition,1980,2008,40,Partial democratization and institutional improvements increased composite strength.
Republic of Honduras / 洪都拉斯共和国,1839,2026,Central America / 中美,41,Contemporary Political Volatility,2009,2026,41,Recent democratic backsliding and resilience produce mixed economic and governance indicators.
Republic of El Salvador / 萨尔瓦多共和国,1841,2026,Central America / 中美,41,Oligarchic and Reform Periods,1841,1931,32,Large-landowner dominance limited broad economic development and inclusive governance.
Republic of El Salvador / 萨尔瓦多共和国,1841,2026,Central America / 中美,41,Military Rule and Repression,1932,1979,36,Authoritarian stability with limited social investment and rising militarization.
Republic of El Salvador / 萨尔瓦多共和国,1841,2026,Central America / 中美,41,Civil War,1980,1992,38,Intense conflict degraded institutions and population but produced subsequent impetus for reform.
Republic of El Salvador / 萨尔瓦多共和国,1841,2026,Central America / 中美,41,Post-War Reconstruction and Modernization,1993,2026,41,Peace-era reforms improved governance and economy though social challenges persist.
Republic of Yucatán / 尤卡坦共和国,1841,1848,Central America / 中美,33,Independent Yucatán Republic,1841,1848,33,Short-lived separatist republic with moderate economic resources but limited longevity.
United Mexican States (Second Federal Republic) / 墨西哥合众国（第二联邦共和国）,1846,1863,Central America / 中美,34,Mexican-American War and Aftermath,1846,1855,30,War losses and political fragmentation weakened economy and governance.
United Mexican States (Second Federal Republic) / 墨西哥合众国（第二联邦共和国）,1846,1863,Central America / 中美,34,Reform Era and Instability,1856,1863,34,Liberal reforms and political contestation improved institutional frameworks but remained fragile.
Republic of Costa Rica (First Republic) / 哥斯达黎加共和国（第一共和国）,1848,1948,Central America / 中美,46,Liberal Consolidation and Coffee Boom,1848,1900,42,Stable elite rule and coffee export growth strengthened fiscal and governance capacity.
Republic of Costa Rica (First Republic) / 哥斯达黎加共和国（第一共和国）,1848,1948,Central America / 中美,46,Welfare Expansion and Institutional Maturation,1901,1948,46,Sustained social investments and stable institutions produced relatively high governance and welfare metrics.
Mexican Empire (Second Empire) / 墨西哥帝国（第二帝国）,1863,1867,Central America / 中美,38,Second Mexican Empire,1863,1867,38,Short foreign-backed imperial regime with limited duration and contested legitimacy.
United Mexican States / 墨西哥合众国,1867,2026,Central America / 中美,64,Restored Republic,1867,1876,48,Reconstruction and institutional rebuilding after empire with moderate economic recovery.
United Mexican States / 墨西哥合众国,1867,2026,Central America / 中美,64,Porfiriato (Authoritarian Modernization),1877,1910,60,"Authoritarian stability with substantial economic growth, infrastructure, and state capacity."
United Mexican States / 墨西哥合众国,1867,2026,Central America / 中美,64,Mexican Revolution and Turbulence,1911,1920,50,Widespread conflict disrupted institutions but led to long-term social and political transformations.
United Mexican States / 墨西哥合众国,1867,2026,Central America / 中美,64,Post-Revolution Institutionalization,1921,1940,58,State-building and land/education reforms strengthened governance and social indicators.
United Mexican States / 墨西哥合众国,1867,2026,Central America / 中美,64,Industrialization and Import Substitution,1941,1970,60,Rapid industrial and urban growth increased economic and technological capacities.
United Mexican States / 墨西哥合众国,1867,2026,Central America / 中美,64,Neoliberal Adjustment,1971,2000,55,Market reforms raised some macro metrics but increased social inequality and governance challenges.
United Mexican States / 墨西哥合众国,1867,2026,Central America / 中美,64,Contemporary Democratic Era,2001,2026,64,"Pluralized politics, stronger institutions, and diversified economy define the present baseline."
Republic of Panama / 巴拿马共和国,1903,2026,Central America / 中美,44,Founding and Canal Era,1903,1939,40,Canal construction and U.S. control established strategic importance but limited inclusive development.
Republic of Panama / 巴拿马共和国,1903,2026,Central America / 中美,44,Canal Sovereignty and Cold War,1940,1979,44,Growing administrative capacity and strategic geopolitics improved state strength.
Republic of Panama / 巴拿马共和国,1903,2026,Central America / 中美,44,Transition to Sovereignty,1980,1999,42,Political maturation and development tempered by inequality and episodic instability.
Republic of Panama / 巴拿马共和国,1903,2026,Central America / 中美,44,Contemporary Political-Economic Era,2000,2026,44,Canal turnover and diversified services underpin stable governance and fiscal capacity.
Republic of Costa Rica (Second Republic) / 哥斯达黎加共和国（第二共和国）,1949,2026,Central America / 中美,50,Founding Welfare-State Consolidation,1949,1979,48,Institutional abolition of the army and social investment built strong governance foundations.
Republic of Costa Rica (Second Republic) / 哥斯达黎加共和国（第二共和国）,1949,2026,Central America / 中美,50,Export Diversification and Stability,1980,1999,50,Stable democracy and diversified economy strengthened governance and social welfare.
Republic of Costa Rica (Second Republic) / 哥斯达黎加共和国（第二共和国）,1949,2026,Central America / 中美,50,Modern Service Economy,2000,2026,50,High institutional quality and mature social services sustain present composite strength.
Belize / 伯利兹,1981,2026,Central America / 中美,32,Independence and Early Statehood,1981,1999,30,Small population and narrow economic base limited administrative and social capacities.
Belize / 伯利兹,1981,2026,Central America / 中美,32,Contemporary Tourism and Institutions,2000,2026,32,Tourism and gradual institutional consolidation modestly improved composite indicators.
Greco-Bactrian Kingdom / 希腊-巴克特里亚王国,-256,-120,Central Asia / 中亚,53,Early Hellenistic Consolidation,-256,-180,50,Hellenistic foundations created urbanized centers and trade networks with moderate reach.
Greco-Bactrian Kingdom / 希腊-巴克特里亚王国,-256,-120,Central Asia / 中亚,53,Apex Hellenistic Polity,-179,-120,53,"Strong cultural synthesis, military capability, and regional economic integration mark the peak."
Kidarite Kingdom / 寄多罗王朝,320,467,Central Asia / 中亚,42,Kidarite Period,320,467,42,Regional nomadic-sedentary polity with limited area and economic depth but notable political cohesion.
Hephthalite Empire / 嚈哒帝国,440,560,Central Asia / 中亚,55,Hephthalite Hegemony,440,560,55,Significant military dominance and cultural imprint across Central Asia with substantial territorial control.
First Turkic Khaganate / 突厥汗国,552,603,Central Asia / 中亚,43,Formation and Consolidation,552,577,40,Initial confederation-building with rising military-political mobility but limited settled economy.
First Turkic Khaganate / 突厥汗国,552,603,Central Asia / 中亚,43,Apex Khaganate,578,603,43,Unified khaganate exhibited peak military reach and political integration across steppe networks.
Western Turkic Khaganate / 西突厥汗国,581,742,Central Asia / 中亚,43,Western Formation,581,640,40,Emergent confederation consolidating control over trade routes with variable administrative structures.
Western Turkic Khaganate / 西突厥汗国,581,742,Central Asia / 中亚,43,Apex Western Khaganate,641,700,43,Strong regional influence and economic control at the polity’s height.
Western Turkic Khaganate / 西突厥汗国,581,742,Central Asia / 中亚,43,Fragmentation and Decline,701,742,37,Internal division and external pressure reduced coherence and institutional capacity.
Tokhara Yabgu State / 吐火罗叶护国,625,758,Central Asia / 中亚,50,Tokhara Formation,625,680,46,Emergence balancing nomadic and urban interests with moderate economic and cultural roles.
Tokhara Yabgu State / 吐火罗叶护国,625,758,Central Asia / 中亚,50,Apex Yabgu Rule,681,740,50,Consolidated regional authority with strong trade links and administrative organization.
Tokhara Yabgu State / 吐火罗叶护国,625,758,Central Asia / 中亚,50,Late Contraction,741,758,42,External incursions and internal weakening reduced territorial and economic strength.
Kyrgyz Khaganate / 黠戛斯汗国,637,925,Central Asia / 中亚,30,Early Confederation,637,750,28,Initial tribal confederation with limited settled economy and narrow demographic base.
Kyrgyz Khaganate / 黠戛斯汗国,637,925,Central Asia / 中亚,30,Peak Steppe Influence,751,820,30,Heightened regional role on the steppe with modest administrative structures.
Kyrgyz Khaganate / 黠戛斯汗国,637,925,Central Asia / 中亚,30,Late Decline,821,925,26,Fragmentation and reduced regional relevance lowered composite indicators.
Turk Shahis / 突厥沙希王朝,665,822,Central Asia / 中亚,43,Early Turk Shahi Rule,665,740,40,Frontier dynasty consolidating control with moderate military and cultural presence.
Turk Shahis / 突厥沙希王朝,665,822,Central Asia / 中亚,43,Apex and Resistance,741,822,43,Heightened military resistance and administrative consolidation mark the polity’s peak.
Zunbil Dynasty / 樽比勒王朝,680,870,Central Asia / 中亚,40,Early Zunbil Period,680,770,38,Regional religious-royal polity with limited demographic and economic scale.
Zunbil Dynasty / 樽比勒王朝,680,870,Central Asia / 中亚,40,Late Zunbil Consolidation,771,870,40,Maintained localized political-religious authority with steady cultural significance.
Second Turkic Khaganate / 后突厥汗国,682,744,Central Asia / 中亚,44,Reconstitution and Consolidation,682,693,38,Initial re-establishment of Turkic authority with growing military-political structures.
Second Turkic Khaganate / 后突厥汗国,682,744,Central Asia / 中亚,44,Apex Khaganate,694,716,44,Peak unity and steppe control with strongest military and political integration.
Second Turkic Khaganate / 后突厥汗国,682,744,Central Asia / 中亚,44,Fragmentation and Decline,717,744,40,Internal succession disputes and external pressure eroded centralized authority.
Türgesh / 突骑施,699,766,Central Asia / 中亚,38,Emergence and Consolidation,699,728,36,Formation of Türgesh power and consolidation of regional client networks.
Türgesh / 突骑施,699,766,Central Asia / 中亚,38,Apex Resistance,729,740,38,Heightened military activity and control over key routes mark the polity’s high point.
Türgesh / 突骑施,699,766,Central Asia / 中亚,38,Decline and Absorption,741,766,34,Loss of cohesion and pressure from rivals reduced territorial and political capacity.
Oghuz Yabgu State / 乌古斯叶护国,750,1055,Central Asia / 中亚,40,Formation and Expansion,750,900,36,Emerging confederation with growing steppe influence but limited settled economy.
Oghuz Yabgu State / 乌古斯叶护国,750,1055,Central Asia / 中亚,40,Apex Confederation,901,1005,40,Peak military-political influence across western steppe corridors and strong tribal cohesion.
Oghuz Yabgu State / 乌古斯叶护国,750,1055,Central Asia / 中亚,40,Fragmentation and Absorption,1006,1055,34,Gradual disintegration and absorption by successor polities reduced autonomy.
Ghurid Dynasty / 古尔王朝,786,1215,Central Asia / 中亚,63,Early Local Rule,786,997,48,Regional chiefs establish dynastic foundations with growing administrative capacity.
Ghurid Dynasty / 古尔王朝,786,1215,Central Asia / 中亚,63,Imperial Expansion and Apex,998,1186,63,Rapid military expansion into northern India and Persia with strong institutional consolidation.
Ghurid Dynasty / 古尔王朝,786,1215,Central Asia / 中亚,63,Late Fragmentation and Decline,1187,1215,50,Successional conflicts and external pressures diminished central authority.
Kara-Khanid Khanate / 喀喇汗国,840,1212,Central Asia / 中亚,54,Formation and Islamization,840,990,48,Consolidation of Turkic elites and gradual Islamicization increased cohesion and trade.
Kara-Khanid Khanate / 喀喇汗国,840,1212,Central Asia / 中亚,54,Apex Transoxianan Polity,991,1105,54,"Peak territorial control, trade integration, and cultural-scholarly influence."
Kara-Khanid Khanate / 喀喇汗国,840,1212,Central Asia / 中亚,54,Decline and Fragmentation,1106,1212,44,Internal division and rising rivals reduced cohesion and regional power.
Khwarazmian Empire / 花剌子模帝国,1077,1231,Central Asia / 中亚,56,Rise and Consolidation,1077,1192,48,Gradual expansion from regional principality to unified state with growing administration.
Khwarazmian Empire / 花剌子模帝国,1077,1231,Central Asia / 中亚,56,Apex under Ala ad-Din Muhammad,1193,1220,56,Rapid territorial expansion and centralized rule mark the empire’s high point.
Khwarazmian Empire / 花剌子模帝国,1077,1231,Central Asia / 中亚,56,Mongol Destruction and Residuals,1221,1231,28,Devastating Mongol invasions collapsed central institutions and sharply reduced capacity.
Qara Khitai / 西辽,1124,1218,Central Asia / 中亚,47,Founding and Consolidation,1124,1150,42,Liao-founded polity establishes rule over diverse Central Asian territories with administrative adaptation.
Qara Khitai / 西辽,1124,1218,Central Asia / 中亚,47,Apex Suzerainty,1151,1185,47,Height of cross-regional suzerainty and commercial-political influence.
Qara Khitai / 西辽,1124,1218,Central Asia / 中亚,47,Decline and Fall,1186,1218,36,Military defeats and pressure from rising neighbors led to loss of authority and territory.
Chagatai Khanate / 察合台汗国,1224,1346,Central Asia / 中亚,47,Unified Chagatai Ulus,1224,1260,44,Early successor-state continuity with control of key Silk Road routes and steppe mobilization.
Chagatai Khanate / 察合台汗国,1224,1346,Central Asia / 中亚,47,Dual Khanate Fragmentation,1261,1300,40,Division between eastern and western factions reduced central governance and cohesion.
Chagatai Khanate / 察合台汗国,1224,1346,Central Asia / 中亚,47,Western Revival under Duwa,1301,1320,47,Temporary political and military consolidation restored regional influence near the overall peak.
Chagatai Khanate / 察合台汗国,1224,1346,Central Asia / 中亚,47,Terminal Disintegration,1321,1346,36,Successional conflict and external pressure fragmented authority and diminished capacity.
Ögedei Khanate / 窝阔台汗国,1224,1309,Central Asia / 中亚,41,Early Ögedeid Ulus,1224,1241,40,Established princely domain with administrative continuity and moderate military reach.
Ögedei Khanate / 窝阔台汗国,1224,1309,Central Asia / 中亚,41,Post-Imperial Decline,1242,1260,35,Imperial succession struggles and decentralization weakened centralized control.
Ögedei Khanate / 窝阔台汗国,1224,1309,Central Asia / 中亚,41,Residual Central Asian Domain,1261,1309,30,Remaining territories persisted but with reduced political and military influence.
Timurid Empire / 帖木儿帝国,1370,1507,Central Asia / 中亚,70,Conquest and Imperial Formation,1370,1405,70,Timur’s campaigns forged a large militarized empire with major cultural and infrastructural patronage.
Timurid Empire / 帖木儿帝国,1370,1507,Central Asia / 中亚,70,Post-Timur Consolidation,1406,1447,64,"Successors maintained significant artistic, administrative, and economic centers despite territorial loss."
